{
  "schema_version": 1,
  "artifact_kind": "stage_profile",
  "generated_utc": "2026-09-05T01:28:16.600040+00:00",
  "provenance": {
    "git_revision": "dfe63bb13908ea147da866c77ae540092d429212",
    "dirty_tree": false,
    "benchmark_command": "benchmarks/profile_sparse_memory_e2e.py --case long_nonpower_bf16 --output results/sparse-memory-e2e/profile.json --trace /tmp/urm-profile-trace.json",
    "config_hash": "cc5fc5293a476373415d45d5a942096987313316fdcebca937883386f57af0c9",
    "solver_version": "4.15.3",
    "python": "3.12.13",
    "platform": "Linux-6.12.100-125.179.amzn2023.x86_64-x86_64-with-glibc2.39",
    "pytorch": "2.8.0",
    "triton": "3.4.0",
    "cuda": "12.9",
    "driver": "595.91.07",
    "gpu": "NVIDIA A10G",
    "gpu_uuid": "GPU-a2c961bc-6e65-f876-5f9d-2900ae525b4e",
    "upstream": {
      "repository": "https://github.com/facebookresearch/sparse-delta-memory",
      "expected_commit": "183e7df809131b80ad4393741029d0f20fc3640b",
      "installed_commit": "183e7df809131b80ad4393741029d0f20fc3640b",
      "checkout_root": "/tmp/urm-sdm-upstream.wKxbSo",
      "module_file": "/tmp/urm-sdm-upstream.wKxbSo/lingua/sparse_delta_memory/layer.py",
      "checkout_dirty": false,
      "license": "CC-BY-NC-4.0",
      "installation": "git checkout plus PYTHONPATH (upstream has no package manifest)",
      "source_usage": "external checkout; no upstream source vendored or modified",
      "runtime_versions": {
        "torch": "2.8.0",
        "triton": "3.4.0",
        "einops": "0.8.2",
        "ninja": "1.13.2"
      }
    }
  },
  "case": {
    "name": "long_nonpower_bf16",
    "operation": "update",
    "classification": "substantial",
    "parallel": 1,
    "sequence": 128,
    "slots": 4096,
    "dim": 95,
    "writes": 4,
    "reads": 4,
    "dtype": "bfloat16",
    "collision": "low"
  },
  "profiler": {
    "tool": "torch.profiler CPU+CUDA activities (Nsight Systems unavailable)",
    "nvtx_ranges": [
      "sparse_memory_e2e::upstream::whole_pipeline",
      "sparse_memory_e2e::native::whole_pipeline",
      "sparse_memory_e2e::hybrid::whole_pipeline",
      "sparse_memory_e2e::upstream::route_production",
      "sparse_memory_e2e::native::route_production",
      "sparse_memory_e2e::upstream::state_mixer",
      "sparse_memory_e2e::native::state_mixer"
    ],
    "trace": "/tmp/urm-profile-trace.json",
    "events": [
      {
        "name": "aten::copy_",
        "count": 65,
        "cpu_time_total_us": 3050.803999999997,
        "self_device_time_total_us": 131.25999999999567
      },
      {
        "name": "Activity Buffer Request",
        "count": 1,
        "cpu_time_total_us": 1977.5680000000002,
        "self_device_time_total_us": 2.400000000000091
      },
      {
        "name": "Memcpy DtoD (Device -> Device)",
        "count": 21,
        "cpu_time_total_us": 0,
        "self_device_time_total_us": 31.5179999999973
      },
      {
        "name": "sparse_memory_e2e::upstream::whole_pipeline",
        "count": 1,
        "cpu_time_total_us": 6821.394,
        "self_device_time_total_us": 0.0
      },
      {
        "name": "aten::topk",
        "count": 18,
        "cpu_time_total_us": 1083.0980000000004,
        "self_device_time_total_us": 179.00800000000208
      },
      {
        "name": "cudaLaunchKernel",
        "count": 254,
        "cpu_time_total_us": 1861.6090000000072,
        "self_device_time_total_us": 3.1679999999996653
      },
      {
        "name": "sparse_memory_e2e::upstream::whole_pipeline",
        "count": 1,
        "cpu_time_total_us": 0,
        "self_device_time_total_us": 6520.622
      },
      {
        "name": "void at::native::elementwise_kernel<128, 4, at::native::gpu_kernel_impl_nocast<at::native::direct_copy_kernel_cuda(at::TensorIteratorBase&)::{lambda()#3}::operator()() const::{lambda()#12}::operator()() const::{lambda(c10::BFloat16)#1}>(at::TensorIteratorBase&, at::native::direct_copy_kernel_cuda(at::TensorIteratorBase&)::{lambda()#3}::operator()() const::{lambda()#12}::operator()() const::{lambda(c10::BFloat16)#1} const&)::{lambda(int)#1}>(int, at::native::gpu_kernel_impl_nocast<at::native::direct_copy_kernel_cuda(at::TensorIteratorBase&)::{lambda()#3}::operator()() const::{lambda()#12}::operator()() const::{lambda(c10::BFloat16)#1}>(at::TensorIteratorBase&, at::native::direct_copy_kernel_cuda(at::TensorIteratorBase&)::{lambda()#3}::operator()() const::{lambda()#12}::operator()() const::{lambda(c10::BFloat16)#1} const&)::{lambda(int)#1})",
        "count": 12,
        "cpu_time_total_us": 0,
        "self_device_time_total_us": 31.74099999999771
      },
      {
        "name": "void at::native::sbtopk::gatherTopK<c10::BFloat16, unsigned int, 2, false>(at::cuda::detail::TensorInfo<c10::BFloat16 const, unsigned int>, unsigned int, unsigned int, bool, unsigned int, unsigned int, at::cuda::detail::TensorInfo<c10::BFloat16, unsigned int>, unsigned int, at::cuda::detail::TensorInfo<long, unsigned int>, unsigned int, c10::BFloat16*)",
        "count": 18,
        "cpu_time_total_us": 0,
        "self_device_time_total_us": 86.71999999999935
      },
      {
        "name": "void at::native::bitonicSortKVInPlace<2, -1, 16, 16, c10::BFloat16, long, at::native::GTOp<c10::BFloat16, true>, unsigned int>(at::cuda::detail::TensorInfo<c10::BFloat16, unsigned int>, unsigned int, unsigned int, unsigned int, at::cuda::detail::TensorInfo<long, unsigned int>, unsigned int, at::native::GTOp<c10::BFloat16, true>)",
        "count": 18,
        "cpu_time_total_us": 0,
        "self_device_time_total_us": 92.28800000000274
      },
      {
        "name": "aten::add",
        "count": 20,
        "cpu_time_total_us": 361.0769999999975,
        "self_device_time_total_us": 41.76099999999997
      },
      {
        "name": "void at::native::elementwise_kernel<128, 4, at::native::gpu_kernel_impl_nocast<at::native::CUDAFunctor_add<c10::BFloat16> >(at::TensorIteratorBase&, at::native::CUDAFunctor_add<c10::BFloat16> const&)::{lambda(int)#1}>(int, at::native::gpu_kernel_impl_nocast<at::native::CUDAFunctor_add<c10::BFloat16> >(at::TensorIteratorBase&, at::native::CUDAFunctor_add<c10::BFloat16> const&)::{lambda(int)#1})",
        "count": 6,
        "cpu_time_total_us": 0,
        "self_device_time_total_us": 16.096999999998843
      },
      {
        "name": "aten::floor_divide",
        "count": 6,
        "cpu_time_total_us": 142.17299999999932,
        "self_device_time_total_us": 15.743000000000393
      },
      {
        "name": "void at::native::vectorized_elementwise_kernel<2, at::native::BUnaryFunctor<long, long, long, at::native::binary_internal::div_floor_kernel_cuda(at::TensorIteratorBase&)::{lambda()#1}::operator()() const::{lambda()#4}::operator()() const::{lambda(long, long)#1}>, std::array<char*, 2ul> >(int, at::native::BUnaryFunctor<long, long, long, at::native::binary_internal::div_floor_kernel_cuda(at::TensorIteratorBase&)::{lambda()#1}::operator()() const::{lambda()#4}::operator()() const::{lambda(long, long)#1}>, std::array<char*, 2ul>)",
        "count": 6,
        "cpu_time_total_us": 0,
        "self_device_time_total_us": 15.743000000000393
      },
      {
        "name": "aten::remainder",
        "count": 6,
        "cpu_time_total_us": 117.63299999999663,
        "self_device_time_total_us": 14.43199999999888
      },
      {
        "name": "void at::native::vectorized_elementwise_kernel<2, at::native::BUnaryFunctor<long, long, long, at::native::remainder_kernel_cuda(at::TensorIteratorBase&)::{lambda()#1}::operator()() const::{lambda()#4}::operator()() const::{lambda(long, long)#1}>, std::array<char*, 2ul> >(int, at::native::BUnaryFunctor<long, long, long, at::native::remainder_kernel_cuda(at::TensorIteratorBase&)::{lambda()#1}::operator()() const::{lambda()#4}::operator()() const::{lambda(long, long)#1}>, std::array<char*, 2ul>)",
        "count": 6,
        "cpu_time_total_us": 0,
        "self_device_time_total_us": 14.43199999999888
      },
      {
        "name": "aten::gather",
        "count": 18,
        "cpu_time_total_us": 437.88899999999376,
        "self_device_time_total_us": 63.935000000001764
      },
      {
        "name": "void at::native::_scatter_gather_elementwise_kernel<128, 8, at::native::_cuda_scatter_gather_internal_kernel<false, at::native::OpaqueType<8>, long>::operator()<at::native::TensorAssign>(at::TensorIterator&, long, long, long, at::native::TensorAssign const&)::{lambda(int)#1}>(int, at::native::_cuda_scatter_gather_internal_kernel<false, at::native::OpaqueType<8>, long>::operator()<at::native::TensorAssign>(at::TensorIterator&, long, long, long, at::native::TensorAssign const&)::{lambda(int)#1})",
        "count": 12,
        "cpu_time_total_us": 0,
        "self_device_time_total_us": 41.503000000000156
      },
      {
        "name": "aten::mul",
        "count": 22,
        "cpu_time_total_us": 394.28699999999753,
        "self_device_time_total_us": 35.39099999999689
      },
      {
        "name": "void at::native::vectorized_elementwise_kernel<2, at::native::AUnaryFunctor<long, long, long, at::native::binary_internal::MulFunctor<long> >, std::array<char*, 2ul> >(int, at::native::AUnaryFunctor<long, long, long, at::native::binary_internal::MulFunctor<long> >, std::array<char*, 2ul>)",
        "count": 6,
        "cpu_time_total_us": 0,
        "self_device_time_total_us": 9.727999999998246
      },
      {
        "name": "void at::native::vectorized_elementwise_kernel<2, at::native::CUDAFunctor_add<long>, std::array<char*, 3ul> >(int, at::native::CUDAFunctor_add<long>, std::array<char*, 3ul>)",
        "count": 6,
        "cpu_time_total_us": 0,
        "self_device_time_total_us": 10.27199999999857
      },
      {
        "name": "aten::arange",
        "count": 32,
        "cpu_time_total_us": 627.2020000000002,
        "self_device_time_total_us": 18.97599999999875
      },
      {